{
  "$schema": "https://json-schema.org/draft/2020-12/schema",
  "title": "Optional short process-summary content",
  "description": "Plain-text content for an A4 short summary. Stages form only a simple consecutive process. This recipe does not guarantee one page; render and review. Use full v2 for other layouts, complex relationships or unresolved required facts.",
  "type": "object",
  "additionalProperties": false,
  "required": ["title", "lead", "stages", "sections", "sources"],
  "properties": {
    "title": {"$ref": "#/$defs/text"},
    "lead": {"$ref": "#/$defs/text"},
    "stages": {
      "type": "array", "minItems": 2, "maxItems": 6,
      "items": {"allOf": [{"$ref": "#/$defs/text"}, {"maxLength": 12}]},
      "description": "Short stage titles in process order, at most 12 characters each. Descriptions belong in sections; no hidden merging or truncation."
    },
    "sections": {
      "type": "array", "minItems": 1,
      "items": {
        "type": "object", "additionalProperties": false,
        "required": ["title", "items"],
        "properties": {
          "title": {"$ref": "#/$defs/text"},
          "items": {"type": "array", "minItems": 1, "items": {"$ref": "#/$defs/text"}}
        }
      }
    },
    "notes": {"type": "array", "items": {"$ref": "#/$defs/text"}},
    "sources": {"type": "array", "minItems": 1, "items": {"$ref": "#/$defs/text"}},
    "facts": {"type": "object", "additionalProperties": {"$ref": "#/$defs/text"}}
  },
  "$defs": {
    "text": {
      "type": "string", "minLength": 1,
      "allOf": [{"pattern": "\\S"}, {"not": {"pattern": "[\\r\\n\\t]"}}],
      "description": "One line of plain text, preserved without summarization. For formatting markup or multiline content use full v2."
    }
  }
}
