{
  "title": "공용 자료 검토 과정 요약",
  "lead": "공유할 자료는 목적을 정한 뒤 검토하고, 공개 이후에도 오류를 바로잡는다.",
  "stages": ["목적 확인", "자료 정리", "내용 검토", "공유·개선"],
  "sections": [
    {"title": "준비", "items": ["독자와 사용 목적을 확인하고 필요한 자료를 모은다.", "중복 자료를 정리하고 출처와 이용 조건을 확인한다."]},
    {"title": "검토와 공유", "items": ["핵심 사실과 표현을 검토하고 개인정보가 불필요하게 포함되지 않았는지 확인한다.", "검토를 마친 자료를 공유하고 발견한 오류와 수정 이력을 기록한다."]}
  ],
  "notes": ["예시용 일반 절차이며 기관별 실제 규정이나 승인 권한을 정한 문서는 아니다."],
  "sources": ["이 레시피의 사용법을 설명하기 위한 가상 작성 예시"],
  "facts": {"change_record": "수정 이력"}
}
